{
  "id": "aaaaaaaa-aaaa-4aaa-8aaa-000000000006",
  "specversion": "1.0",
  "type": "report.started",
  "source": "report-service",
  "time": "2026-10-29T08:00:06Z",
  "subject": "11111111-1111-4111-8111-111111111111",
  "dataschema": "report.started.v1",
  "data": {
    "jobId": "44444444-4444-4444-8444-444444444444",
    "studentId": "11111111-1111-4111-8111-111111111111",
    "reportId": "77777777-7777-4777-8777-777777777777"
  }
}
