{
  "id": "aaaaaaaa-aaaa-4aaa-8aaa-000000000004",
  "specversion": "1.0",
  "type": "report.completed",
  "source": "report-service",
  "time": "2026-10-29T08:00:04Z",
  "subject": "11111111-1111-4111-8111-111111111111",
  "dataschema": "report.completed.v1",
  "data": {
    "jobId": "33333333-3333-4333-8333-333333333333",
    "studentId": "11111111-1111-4111-8111-111111111111",
    "reportId": "66666666-6666-4666-8666-666666666666"
  }
}
